{
  "spec_version": 1,
  "asset_id": "preset_bass_pick",
  "asset_type": "audio",
  "license": "CC0-1.0",
  "seed": 10103,
  "description": "Picked bass - Karplus-Strong synthesis with fast attack and moderate decay for articulate plucked character",
  "outputs": [
    {
      "kind": "primary",
      "format": "wav",
      "path": "test-outputs/preset_library_v1/audio/bass/bass_pick.wav"
    }
  ],
  "recipe": {
    "kind": "audio_v1",
    "params": {
      "base_note": "C2",
      "duration_seconds": 0.8,
      "sample_rate": 44100,
      "layers": [
        {
          "synthesis": {
            "type": "karplus_strong",
            "frequency": 65.41,
            "decay": 0.995,
            "blend": 0.7
          },
          "envelope": {
            "attack": 0.001,
            "decay": 0.25,
            "sustain": 0.5,
            "release": 0.15
          },
          "volume": 1.0,
          "pan": 0
        }
      ]
    }
  }
}
