{
    "spec_version": 1,
    "asset_id": "preset_bell_soft",
    "asset_type": "audio",
    "license": "CC0-1.0",
    "seed": 10251,
    "description": "Soft bell - muted, gentle bell with reduced overtones and warm character",
    "outputs": [
        {
            "kind": "primary",
            "format": "wav",
            "path": "test-outputs/preset_library_v1/audio/bells/bell_soft.wav"
        }
    ],
    "recipe": {
        "kind": "audio_v1",
        "params": {
            "base_note": "A5",
            "duration_seconds": 2.5,
            "sample_rate": 44100,
            "layers": [
                {
                    "synthesis": {
                        "type": "fm_synth",
                        "carrier_freq": 880.0,
                        "modulator_freq": 1320.0,
                        "modulation_index": 1.2
                    },
                    "envelope": {
                        "attack": 0.012,
                        "decay": 0.9,
                        "sustain": 0.15,
                        "release": 1.6
                    },
                    "volume": 0.55,
                    "pan": 0.0
                },
                {
                    "synthesis": {
                        "type": "oscillator",
                        "waveform": "sine",
                        "frequency": 440.0
                    },
                    "envelope": {
                        "attack": 0.008,
                        "decay": 1.0,
                        "sustain": 0.25,
                        "release": 1.4
                    },
                    "volume": 0.35,
                    "pan": 0.0
                },
                {
                    "synthesis": {
                        "type": "oscillator",
                        "waveform": "triangle",
                        "frequency": 440.0
                    },
                    "envelope": {
                        "attack": 0.015,
                        "decay": 0.8,
                        "sustain": 0.1,
                        "release": 1.2
                    },
                    "volume": 0.18,
                    "pan": 0.0
                },
                {
                    "synthesis": {
                        "type": "oscillator",
                        "waveform": "sine",
                        "frequency": 440.0
                    },
                    "envelope": {
                        "attack": 0.025,
                        "decay": 0.5,
                        "sustain": 0.05,
                        "release": 0.8
                    },
                    "volume": 0.08,
                    "pan": 0.0
                }
            ],
            "effects": [
                {
                    "type": "chorus",
                    "rate": 0.4,
                    "depth": 0.15,
                    "wet": 0.2,
                    "voices": 2
                },
                {
                    "type": "reverb",
                    "room_size": 0.72,
                    "damping": 0.75,
                    "wet": 0.45,
                    "width": 0.5
                }
            ]
        }
    }
}