{
  "spec_version": 1,
  "asset_id": "preset_perc_break_layer",
  "asset_type": "audio",
  "license": "CC0-1.0",
  "seed": 20010,
  "description": "Breakbeat percussion layer - punchy mid-freq hit for layering with kicks/snares",
  "outputs": [{
    "kind": "primary",
    "format": "wav",
    "path": "test-outputs/preset_library_v1/audio/drums/percussion/perc_break_layer.wav"
  }],
  "recipe": {
    "kind": "audio_v1",
    "params": {
      "duration_seconds": 0.25,
      "sample_rate": 44100,
      "layers": [
        {
          "synthesis": {
            "type": "oscillator",
            "waveform": "triangle",
            "frequency": 800,
            "freq_sweep": {
              "end_freq": 400,
              "curve": "exponential"
            }
          },
          "envelope": {
            "attack": 0.001,
            "decay": 0.08,
            "sustain": 0,
            "release": 0.04
          },
          "volume": 0.7,
          "pan": 0
        },
        {
          "synthesis": {
            "type": "noise_burst",
            "noise_type": "white",
            "filter": {
              "type": "bandpass",
              "center": 2500,
              "resonance": 0.4
            }
          },
          "envelope": {
            "attack": 0.001,
            "decay": 0.05,
            "sustain": 0,
            "release": 0.03
          },
          "volume": 0.5,
          "pan": 0
        }
      ]
    }
  }
}
