{
    "spec_version": 1,
    "asset_id": "pluck_steel",
    "asset_type": "audio",
    "license": "CC0-1.0",
    "seed": 10154,
    "description": "Professional steel string acoustic guitar pluck - bright metallic attack, rich harmonics, natural body resonance",
    "outputs": [
        {
            "kind": "primary",
            "format": "wav",
            "path": "test-outputs/preset_library_v1/audio/plucks/pluck_steel.wav"
        }
    ],
    "recipe": {
        "kind": "audio_v1",
        "params": {
            "duration_seconds": 2.5,
            "sample_rate": 44100,
            "layers": [
                {
                    "synthesis": {
                        "type": "karplus_strong",
                        "frequency": 329.63,
                        "decay": 0.9965,
                        "blend": 0.08
                    },
                    "envelope": {
                        "attack": 0.0005,
                        "decay": 0.15,
                        "sustain": 0.55,
                        "release": 0.4
                    },
                    "volume": 0.85,
                    "pan": 0.0,
                    "filter": {
                        "type": "highpass",
                        "cutoff": 180.0,
                        "resonance": 0.3
                    }
                },
                {
                    "synthesis": {
                        "type": "karplus_strong",
                        "frequency": 659.26,
                        "decay": 0.992,
                        "blend": 0.05
                    },
                    "envelope": {
                        "attack": 0.0005,
                        "decay": 0.06,
                        "sustain": 0.3,
                        "release": 0.15
                    },
                    "volume": 0.35,
                    "pan": 0.0,
                    "filter": {
                        "type": "highpass",
                        "cutoff": 800.0,
                        "resonance": 0.5
                    }
                },
                {
                    "synthesis": {
                        "type": "metallic",
                        "base_freq": 329.63,
                        "num_partials": 12,
                        "inharmonicity": 0.015
                    },
                    "envelope": {
                        "attack": 0.001,
                        "decay": 0.08,
                        "sustain": 0.2,
                        "release": 0.12
                    },
                    "volume": 0.28,
                    "pan": 0.0,
                    "filter": {
                        "type": "bandpass",
                        "center": 3200.0,
                        "resonance": 1.2
                    }
                },
                {
                    "synthesis": {
                        "type": "pitched_body",
                        "start_freq": 329.63,
                        "end_freq": 164.815
                    },
                    "envelope": {
                        "attack": 0.005,
                        "decay": 0.25,
                        "sustain": 0.4,
                        "release": 0.6
                    },
                    "volume": 0.22,
                    "pan": 0.0,
                    "filter": {
                        "type": "lowpass",
                        "cutoff": 4500.0,
                        "resonance": 0.4
                    }
                },
                {
                    "synthesis": {
                        "type": "noise_burst",
                        "noise_type": "white"
                    },
                    "envelope": {
                        "attack": 0.0001,
                        "decay": 0.008,
                        "sustain": 0,
                        "release": 0.004
                    },
                    "volume": 0.18,
                    "pan": 0.0,
                    "filter": {
                        "type": "highpass",
                        "cutoff": 2800.0,
                        "resonance": 0.8
                    }
                }
            ],
            "effects": [
                {
                    "type": "compressor",
                    "threshold_db": -18.0,
                    "ratio": 3.5,
                    "attack_ms": 2.0,
                    "release_ms": 80.0,
                    "makeup_db": 0
                },
                {
                    "type": "chorus",
                    "rate": 1.2,
                    "depth": 0.15,
                    "wet": 0.12,
                    "voices": 2
                },
                {
                    "type": "reverb",
                    "room_size": 0.28,
                    "damping": 0.6,
                    "wet": 0.18,
                    "width": 0.5
                }
            ]
        }
    }
}