{
  "spec_version": 1,
  "asset_id": "pluck_string",
  "asset_type": "audio",
  "license": "CC0-1.0",
  "seed": 1010,
  "description": "Karplus-Strong plucked string sound",
  "outputs": [
    {
      "kind": "primary",
      "format": "wav",
      "path": "pluck_string.wav"
    }
  ],
  "recipe": {
    "kind": "audio_v1",
    "params": {
      "duration_seconds": 0.8,
      "sample_rate": 44100,
      "layers": [
        {
          "synthesis": {
            "type": "karplus_strong",
            "frequency": 330.0,
            "decay": 0.995,
            "blend": 0.8
          },
          "envelope": {
            "attack": 0.001,
            "decay": 0.3,
            "sustain": 0.4,
            "release": 0.3
          },
          "volume": 1.0,
          "pan": 0.0
        }
      ]
    }
  }
}
