{
  "spec_version": 1,
  "asset_id": "preset_cajon",
  "asset_type": "audio",
  "license": "CC0-1.0",
  "seed": 10091,
  "description": "Cajon - box drum with mix of kick and snare character",
  "outputs": [
    {
      "kind": "primary",
      "format": "wav",
      "path": "test-outputs/preset_library_v1/audio/drums/percussion/cajon.wav"
    }
  ],
  "recipe": {
    "kind": "audio_v1",
    "params": {
      "duration_seconds": 0.5,
      "sample_rate": 44100,
      "layers": [
        {
          "synthesis": {
            "type": "modal",
            "frequency": 95,
            "modes": [
              {
                "freq_ratio": 1.0,
                "amplitude": 1.0,
                "decay_time": 0.45
              },
              {
                "freq_ratio": 2.17,
                "amplitude": 0.55,
                "decay_time": 0.32
              },
              {
                "freq_ratio": 3.41,
                "amplitude": 0.38,
                "decay_time": 0.25
              },
              {
                "freq_ratio": 4.89,
                "amplitude": 0.28,
                "decay_time": 0.18
              },
              {
                "freq_ratio": 6.71,
                "amplitude": 0.18,
                "decay_time": 0.14
              }
            ],
            "excitation": "impulse"
          },
          "envelope": {
            "attack": 0.001,
            "decay": 0.45,
            "sustain": 0,
            "release": 0.05
          },
          "volume": 0.85,
          "pan": 0
        },
        {
          "synthesis": {
            "type": "noise_burst",
            "noise_type": "white"
          },
          "envelope": {
            "attack": 0.0005,
            "decay": 0.035,
            "sustain": 0,
            "release": 0.025
          },
          "lfo": {
            "config": {
              "waveform": "sine",
              "rate": 4.2,
              "depth": 0.12
            },
            "target": {
              "target": "filter_cutoff",
              "amount": 180
            }
          },
          "volume": 0.65,
          "pan": 0,
          "filter": {
            "type": "bandpass",
            "center": 2200,
            "resonance": 0.5
          }
        },
        {
          "synthesis": {
            "type": "noise_burst",
            "noise_type": "pink"
          },
          "envelope": {
            "attack": 0.001,
            "decay": 0.08,
            "sustain": 0,
            "release": 0.04
          },
          "lfo": {
            "config": {
              "waveform": "triangle",
              "rate": 3.8,
              "depth": 0.09
            },
            "target": {
              "target": "filter_cutoff",
              "amount": 220
            }
          },
          "volume": 0.35,
          "pan": 0,
          "filter": {
            "type": "highpass",
            "cutoff": 800,
            "resonance": 0.5
          }
        }
      ],
      "effects": [
        {
          "type": "reverb",
          "room_size": 0.25,
          "damping": 0.6,
          "wet": 0.15
        },
        {
          "type": "compressor",
          "ratio": 3.5,
          "threshold_db": -18,
          "attack_ms": 0.1,
          "release_ms": 10,
          "makeup_db": 0
        }
      ]
    }
  }
}
