{
  "spec_version": 1,
  "asset_id": "preset_kick_909",
  "asset_type": "audio",
  "license": "CC0-1.0",
  "seed": 10102,
  "description": "Professional TR-909 kick - punchy transient, tight decay, perfect for house and techno",
  "outputs": [
    {
      "kind": "primary",
      "format": "wav",
      "path": "test-outputs/preset_library_v1/audio/drums/kicks/kick_909.wav"
    }
  ],
  "recipe": {
    "kind": "audio_v1",
    "params": {
      "duration_seconds": 0.3,
      "sample_rate": 44100,
      "layers": [
        {
          "synthesis": {
            "type": "oscillator",
            "waveform": "sine",
            "frequency": 165,
            "freq_sweep": {
              "end_freq": 45,
              "curve": "exponential"
            }
          },
          "envelope": {
            "attack": 0.0005,
            "decay": 0.08,
            "sustain": 0,
            "release": 0.11
          },
          "volume": 1,
          "pan": 0
        },
        {
          "synthesis": {
            "type": "noise_burst",
            "noise_type": "white",
            "filter": {
              "type": "bandpass",
              "center": 4200,
              "resonance": 0.65
            }
          },
          "envelope": {
            "attack": 0,
            "decay": 0.003,
            "sustain": 0,
            "release": 0.002
          },
          "volume": 0.45,
          "pan": 0
        },
        {
          "synthesis": {
            "type": "oscillator",
            "waveform": "sine",
            "frequency": 65,
            "freq_sweep": {
              "end_freq": 55,
              "curve": "exponential"
            }
          },
          "envelope": {
            "attack": 0.001,
            "decay": 0.06,
            "sustain": 0,
            "release": 0.08
          },
          "volume": 0.3,
          "pan": 0,
          "lfo": {
            "config": {
              "waveform": "sine",
              "rate": 45,
              "depth": 0.15
            },
            "target": {
              "target": "pitch",
              "semitones": 0.08
            }
          }
        }
      ],
      "effects": [
        {
          "type": "waveshaper",
          "drive": 1.6,
          "curve": "tanh",
          "wet": 0.35
        },
        {
          "type": "reverb",
          "room_size": 0.18,
          "damping": 0.75,
          "wet": 0.08
        }
      ]
    }
  }
}