{
  "spec_version": 1,
  "asset_id": "audio-instrument-pitched-body-golden",
  "asset_type": "audio",
  "license": "CC0-1.0",
  "seed": 999018,
  "description": "Golden test for pitched body synthesis - exercises start_freq and end_freq for impact sounds",
  "style_tags": [
    "golden",
    "pitched-body",
    "impact",
    "instrument"
  ],
  "engine_targets": [
    "godot",
    "unity",
    "unreal"
  ],
  "outputs": [
    {
      "kind": "primary",
      "format": "wav",
      "path": "audio_instrument_pitched_body.wav"
    }
  ],
  "recipe": {
    "kind": "audio_v1",
    "params": {
      "base_note": "C4",
      "duration_seconds": 0.5,
      "sample_rate": 44100,
      "layers": [
        {
          "synthesis": {
            "type": "pitched_body",
            "start_freq": 200.0,
            "end_freq": 50.0
          },
          "envelope": {
            "attack": 0.001,
            "decay": 0.1,
            "sustain": 0.3,
            "release": 0.35
          },
          "volume": 1.0,
          "pan": 0.0
        }
      ]
    }
  }
}
