{
  "spec_version": 1,
  "asset_id": "hihat_closed",
  "asset_type": "audio",
  "license": "CC0-1.0",
  "seed": 1008,
  "description": "Synthesized closed hi-hat - metallic noise",
  "outputs": [
    {
      "kind": "primary",
      "format": "wav",
      "path": "hihat_closed.wav"
    }
  ],
  "recipe": {
    "kind": "audio_v1",
    "params": {
      "duration_seconds": 0.08,
      "sample_rate": 44100,
      "layers": [
        {
          "synthesis": {
            "type": "metallic",
            "base_freq": 8000.0,
            "num_partials": 6,
            "inharmonicity": 2.14
          },
          "envelope": {
            "attack": 0.001,
            "decay": 0.025,
            "sustain": 0.0,
            "release": 0.04
          },
          "volume": 0.6,
          "pan": 0.0
        },
        {
          "synthesis": {
            "type": "noise_burst",
            "noise_type": "white",
            "filter": {
              "type": "highpass",
              "cutoff": 9000.0,
              "resonance": 0.5
            }
          },
          "envelope": {
            "attack": 0.001,
            "decay": 0.02,
            "sustain": 0.0,
            "release": 0.025
          },
          "volume": 0.5,
          "pan": 0.0
        }
      ]
    }
  }
}
