{
    "spec_version": 1,
    "asset_id": "texture_vinyl",
    "asset_type": "audio",
    "license": "CC0-1.0",
    "seed": 10601,
    "description": "Vinyl crackle / lo-fi character - pink noise with tiny grains and position randomization",
    "outputs": [
        {
            "kind": "primary",
            "format": "wav",
            "path": "test-outputs/preset_library_v1/audio/textures/texture_vinyl.wav"
        }
    ],
    "recipe": {
        "kind": "audio_v1",
        "params": {
            "duration_seconds": 4.0,
            "sample_rate": 44100,
            "layers": [
                {
                    "synthesis": {
                        "type": "granular",
                        "source": {
                            "type": "noise",
                            "noise_type": "pink"
                        },
                        "grain_size_ms": 15.0,
                        "grain_density": 35.0,
                        "pitch_spread": 0.1,
                        "position_spread": 0.7,
                        "pan_spread": 0.4
                    },
                    "envelope": {
                        "attack": 0.8,
                        "decay": 0.2,
                        "sustain": 0.8,
                        "release": 0.8
                    },
                    "volume": 0.35,
                    "pan": 0.0,
                    "lfo": {
                        "config": {
                            "waveform": "sine",
                            "rate": 0.3,
                            "depth": 0.4
                        },
                        "target": {
                            "target": "filter_cutoff",
                            "amount": 0.15
                        }
                    }
                },
                {
                    "synthesis": {
                        "type": "granular",
                        "source": {
                            "type": "noise",
                            "noise_type": "white"
                        },
                        "grain_size_ms": 8.0,
                        "grain_density": 22.0,
                        "pitch_spread": 0.25,
                        "position_spread": 0.85,
                        "pan_spread": 0.6
                    },
                    "envelope": {
                        "attack": 0.05,
                        "decay": 0.1,
                        "sustain": 0.7,
                        "release": 0.3
                    },
                    "volume": 0.18,
                    "pan": 0.0
                },
                {
                    "synthesis": {
                        "type": "granular",
                        "source": {
                            "type": "noise",
                            "noise_type": "brown"
                        },
                        "grain_size_ms": 25.0,
                        "grain_density": 18.0,
                        "pitch_spread": 0.05,
                        "position_spread": 0.5,
                        "pan_spread": 0.3
                    },
                    "envelope": {
                        "attack": 1.0,
                        "decay": 0.3,
                        "sustain": 0.85,
                        "release": 1.2
                    },
                    "volume": 0.25,
                    "pan": 0.0,
                    "lfo": {
                        "config": {
                            "waveform": "sine",
                            "rate": 6.2,
                            "depth": 0.3
                        },
                        "target": {
                            "target": "pitch",
                            "semitones": 0.08
                        }
                    }
                }
            ],
            "master_filter": {
                "type": "lowpass",
                "cutoff": 4000.0,
                "resonance": 0.2
            },
            "effects": [
                {
                    "type": "bitcrush",
                    "bits": 13,
                    "sample_rate_divisor": 2,
                    "wet": 0.35
                },
                {
                    "type": "compressor",
                    "threshold_db": -18.0,
                    "ratio": 3.5,
                    "attack_ms": 15.0,
                    "release_ms": 85.0,
                    "makeup_db": 4.0
                },
                {
                    "type": "reverb",
                    "room_size": 0.25,
                    "damping": 0.7,
                    "wet": 0.12
                }
            ]
        }
    }
}