{
  "spec_version": 1,
  "asset_id": "prop_sword",
  "asset_type": "static_mesh",
  "license": "CC0-1.0",
  "seed": 7801,
  "description": "Medieval sword prop - tapered blade, crossguard, wrapped handle, and pommel",
  "style_tags": ["prop", "weapon", "sword", "medieval", "fantasy"],
  "engine_targets": ["godot", "unity", "unreal"],
  "outputs": [
    {
      "kind": "primary",
      "format": "glb",
      "path": "test-outputs/static_mesh/prop_sword.glb"
    }
  ],
  "recipe": {
    "kind": "static_mesh.blender_primitives_v1",
    "params": {
      "base_primitive": "cube",
      "dimensions": [0.10, 0.70, 0.025],
      "uv_projection": "box",
      "attachments": [
        {
          "primitive": "cube",
          "dimensions": [0.08, 0.20, 0.02],
          "position": [0.0, 0.43, 0.0],
          "rotation": [0.0, 0.0, 0.0]
        },
        {
          "primitive": "cube",
          "dimensions": [0.05, 0.16, 0.015],
          "position": [0.0, 0.59, 0.0],
          "rotation": [0.0, 0.0, 0.0]
        },
        {
          "primitive": "cone",
          "dimensions": [0.03, 0.03, 0.10],
          "position": [0.0, 0.70, 0.0],
          "rotation": [0.0, 0.0, 0.0]
        },
        {
          "primitive": "cube",
          "dimensions": [0.40, 0.08, 0.08],
          "position": [0.0, -0.35, 0.0],
          "rotation": [0.0, 0.0, 0.0]
        },
        {
          "primitive": "sphere",
          "dimensions": [0.07, 0.07, 0.07],
          "position": [-0.20, -0.35, 0.0],
          "rotation": [0.0, 0.0, 0.0]
        },
        {
          "primitive": "sphere",
          "dimensions": [0.07, 0.07, 0.07],
          "position": [0.20, -0.35, 0.0],
          "rotation": [0.0, 0.0, 0.0]
        },
        {
          "primitive": "cylinder",
          "dimensions": [0.04, 0.04, 0.32],
          "position": [0.0, -0.47, 0.0],
          "rotation": [0.0, 0.0, 0.0]
        },
        {
          "primitive": "cylinder",
          "dimensions": [0.05, 0.05, 0.04],
          "position": [0.0, -0.62, 0.0],
          "rotation": [0.0, 0.0, 0.0]
        },
        {
          "primitive": "sphere",
          "dimensions": [0.08, 0.08, 0.08],
          "position": [0.0, -0.65, 0.0],
          "rotation": [0.0, 0.0, 0.0]
        },
        {
          "primitive": "cube",
          "dimensions": [0.012, 0.65, 0.004],
          "position": [0.0, 0.025, 0.014],
          "rotation": [0.0, 0.0, 0.0]
        }
      ],
      "material_slots": [
        {
          "name": "blade_steel",
          "base_color": [0.75, 0.78, 0.80, 1.0],
          "metallic": 0.9,
          "roughness": 0.3
        },
        {
          "name": "handle_dark",
          "base_color": [0.15, 0.12, 0.10, 1.0],
          "metallic": 0.2,
          "roughness": 0.7
        },
        {
          "name": "gold_accent",
          "base_color": [0.85, 0.65, 0.13, 1.0],
          "metallic": 0.95,
          "roughness": 0.2
        }
      ],
      "export": {
        "apply_modifiers": true,
        "triangulate": true,
        "include_normals": true,
        "include_uvs": true,
        "include_vertex_colors": false
      }
    }
  }
}
